{
  "checks": {
    "batch_consistency": "PASS",
    "fit_failure_count": 0,
    "fit_statuses": [
      "PASS",
      "PASS",
      "PASS",
      "PASS",
      "PASS",
      "PASS"
    ],
    "layout_ids": [
      "layout-decision-hero",
      "layout-process-flow",
      "layout-risk-evidence-grid",
      "layout-options-matrix",
      "layout-recommendation-focus",
      "layout-roadmap-sources"
    ],
    "layout_repetition_violation_count": 0,
    "maximum_consecutive_layout_repetition": 1,
    "module_differentiation": "PASS",
    "module_ids": [
      "module-01-section_01_understand",
      "module-01-section_01_understand",
      "module-02-section_02_evaluate",
      "module-02-section_02_evaluate",
      "module-03-section_03_act",
      "module-03-section_03_act"
    ],
    "target_count": 6,
    "target_dimension_failure_count": 0,
    "unauthorized_fallback_count": 0,
    "unique_layout_count": 6,
    "unique_module_count": 3,
    "visual_targets": [
      {
        "height": 936,
        "path": "visual_targets/slide-001.png",
        "sha256": "bb529c9644837050e4cf3a611e81dbaf9038fb083af13e262e79488f3966170f",
        "width": 1664
      },
      {
        "height": 936,
        "path": "visual_targets/slide-002.png",
        "sha256": "37f42109e03e22d0721da51ffd571e0a78452a5be1447bbcaec4f2d4008c9c72",
        "width": 1664
      },
      {
        "height": 936,
        "path": "visual_targets/slide-003.png",
        "sha256": "96fc9ac2da10198a5cf2edf1f2fe44b089618dc1c72f8cd0c3c51313c19bb3d4",
        "width": 1664
      },
      {
        "height": 936,
        "path": "visual_targets/slide-004.png",
        "sha256": "af9492fece0b40fc2f67ed42a1d073e2b82002eb15c58c64f955fe0cc70d9dbf",
        "width": 1664
      },
      {
        "height": 936,
        "path": "visual_targets/slide-005.png",
        "sha256": "8f42a53fd1fe62851082c147a280f2ac8487f450e0743d55a0c3c91d516ebb52",
        "width": 1664
      },
      {
        "height": 936,
        "path": "visual_targets/slide-006.png",
        "sha256": "0274db749369959daac7fed17331e7f007ff5c47cc7b824698c3c298f5c0e4c2",
        "width": 1664
      }
    ]
  },
  "created_at": "2026-07-22T10:30:00+09:00",
  "findings": [],
  "implementation_provenance": {
    "acceptance_authority": "DeckCompiler independent composite gate",
    "component": "presentation_agent.deckcompiler.qa",
    "deckcompiler_commit": "e2a6fabb1916680800097981fbda27abfe02b852",
    "detector_version": "1.0.0",
    "external_outputs_may_self_accept": false
  },
  "producer": "DeckCompiler creative QA",
  "report_hash": "cc187e925f1f9c5bf3542fae0d85a4467710822336fc9e79eeb736b1338b2cff",
  "report_id": "report_909f4a29abddd4fb76b6",
  "run_id": "phase6qa_9bd9b0fcf02397f92902",
  "schema_name": "phase6_creative_qa_report",
  "schema_version": "1.0.0",
  "severity_counts": {
    "error": 0,
    "info": 0,
    "severe": 0,
    "warning": 0
  },
  "source_artifacts": [
    {
      "artifact_id": "phase4-input-provenance",
      "path": "examples/deckcompiler_demo/phase4/input_provenance.json",
      "sha256": "d8e7659a779c7085d23a7ca049a9a9515401f943587f4d2365c11e6675a695ea"
    },
    {
      "artifact_id": "phase4-geometry-fit",
      "path": "examples/deckcompiler_demo/phase4/geometry_fit_report.json",
      "sha256": "dcd87abdebfaffd19dfc1cddde1738329f134756df3f6481bd18f9024142f451"
    },
    {
      "artifact_id": "phase4-bundle-acceptance",
      "path": "examples/deckcompiler_demo/phase4/phase4_bundle_acceptance.json",
      "sha256": "9e8570f96ae54e9666f54c6d2e0d0a6bc0affd54f1823a3cac7ee34a3172a2bd"
    },
    {
      "artifact_id": "phase5-handoff",
      "path": "examples/deckcompiler_demo/phase5/handoff/pngtopptx_handoff_manifest.json",
      "sha256": "8548e4a21a0df26b4747af2273e407bd66a8d6c956a63d29d78cb5de67f35678"
    },
    {
      "artifact_id": "phase5-reconstruction-constraints",
      "path": "examples/deckcompiler_demo/phase5/handoff/reconstruction_constraints.json",
      "sha256": "4f15ad4dcf389647d4db7bcd54b35f9db913f730d86bb1ae0f044ea89df04c46"
    },
    {
      "artifact_id": "external-skillset-pin",
      "path": "examples/deckcompiler_demo/phase5/external_skillset_pin.json",
      "sha256": "be35c664bb3ed366d0ab558a58554f55cad2de56f790b1e0b68824ea45aee94a"
    },
    {
      "artifact_id": "active-pptx",
      "path": "active-output/pptx_generator_demo.pptx",
      "sha256": "805eb4aa3d44d90ebe5b78c0247d02e412ebfc9468e57c778516b90de2d27676"
    },
    {
      "artifact_id": "active-html",
      "path": "active-output/html/index.html",
      "sha256": "b1f161bed4d1dc37be576eceda0cf01d125580df4a767c4722582c8671983085"
    },
    {
      "artifact_id": "artifact_db86bcbfdee3abef7294",
      "path": "examples/deckcompiler_demo/phase4/semantic_sidecars/slide-001.semantic.json",
      "sha256": "d64efb0fd8be9ae34be946e2649bf4462e22d9bce2b05418f9e27a9385877bc6"
    },
    {
      "artifact_id": "artifact_e9de634311cff9b3cac9",
      "path": "examples/deckcompiler_demo/phase4/semantic_sidecars/slide-002.semantic.json",
      "sha256": "8716555d40f109bff559039a82bbc50004a663f5c0d2e10f4b35aa848214cc2c"
    },
    {
      "artifact_id": "artifact_5127d8d1b1277c8f24c0",
      "path": "examples/deckcompiler_demo/phase4/semantic_sidecars/slide-003.semantic.json",
      "sha256": "e2268e400f51926e669e4f51bf2b474ba8f6a1eb58fbf8fb1786b239825cc6c3"
    },
    {
      "artifact_id": "artifact_35f461ccdb3954692c6d",
      "path": "examples/deckcompiler_demo/phase4/semantic_sidecars/slide-004.semantic.json",
      "sha256": "a358fd52748cb0bb93699dea9b31c55927b8f72799e4aded4f8331065324a7b9"
    },
    {
      "artifact_id": "artifact_b0fd337c0c45086f70ea",
      "path": "examples/deckcompiler_demo/phase4/semantic_sidecars/slide-005.semantic.json",
      "sha256": "a17b19ecb3c5453aa548a9df1e57cbc09bdb2fb19fb6b4813d7c611dd79add8a"
    },
    {
      "artifact_id": "artifact_8ab300926d3f1c88b773",
      "path": "examples/deckcompiler_demo/phase4/semantic_sidecars/slide-006.semantic.json",
      "sha256": "fbb6d67cbccff2b063d50fdca7d20dd3290e895655066ea8d89faf73fe959587"
    },
    {
      "artifact_id": "artifact_44ec7963d6feaff563f7",
      "path": "examples/deckcompiler_demo/phase4/visual_targets/slide-001.png",
      "sha256": "bb529c9644837050e4cf3a611e81dbaf9038fb083af13e262e79488f3966170f"
    },
    {
      "artifact_id": "artifact_ecd46b993bd43411da8d",
      "path": "examples/deckcompiler_demo/phase4/visual_targets/slide-002.png",
      "sha256": "37f42109e03e22d0721da51ffd571e0a78452a5be1447bbcaec4f2d4008c9c72"
    },
    {
      "artifact_id": "artifact_1a7b4d65e364654ef53d",
      "path": "examples/deckcompiler_demo/phase4/visual_targets/slide-003.png",
      "sha256": "96fc9ac2da10198a5cf2edf1f2fe44b089618dc1c72f8cd0c3c51313c19bb3d4"
    },
    {
      "artifact_id": "artifact_7ff0d34d99747d7192b1",
      "path": "examples/deckcompiler_demo/phase4/visual_targets/slide-004.png",
      "sha256": "af9492fece0b40fc2f67ed42a1d073e2b82002eb15c58c64f955fe0cc70d9dbf"
    },
    {
      "artifact_id": "artifact_e41b00231acf2abd7c05",
      "path": "examples/deckcompiler_demo/phase4/visual_targets/slide-005.png",
      "sha256": "8f42a53fd1fe62851082c147a280f2ac8487f450e0743d55a0c3c91d516ebb52"
    },
    {
      "artifact_id": "artifact_e591dce29ea61dc74250",
      "path": "examples/deckcompiler_demo/phase4/visual_targets/slide-006.png",
      "sha256": "0274db749369959daac7fed17331e7f007ff5c47cc7b824698c3c298f5c0e4c2"
    }
  ],
  "status": "PASS",
  "timezone": "Asia/Seoul"
}
